{
  "$schema": "../category.schema.json",
  "name": "ai",
  "description": "AI/ML inference servers and model hosting",
  "aliases": [
    "llm",
    "ml",
    "models",
    "inference",
    "machine-learning"
  ],
  "tags": [
    "ai",
    "ml",
    "inference"
  ],
  "connection": {
    "protocol": "http",
    "uri_template": "http://{host}:{port}"
  }
}
