{
  "$schema": "../category.schema.json",
  "name": "storage",
  "description": "Object storage, file storage, and cloud storage solutions",
  "aliases": [
    "s3",
    "object-storage",
    "files",
    "blob"
  ],
  "tags": [
    "storage",
    "files",
    "objects"
  ],
  "connection": {
    "protocol": "http",
    "uri_template": "http://{host}:{port}"
  }
}
